{
  "schema_version": "3.0.0",
  "decision_id": "decision_fixture_tokenizer_ownership",
  "status": "accepted",
  "question": "Should TL100 train its tokenizer or borrow a pretrained vocabulary?",
  "options_considered": [
    {
      "option_id": "own_byte_bpe",
      "summary": "Implement and train a readable byte-level BPE tokenizer on the approved TL100 corpus.",
      "advantages": ["The vocabulary and every merge are inspectable.", "The training corpus is traceable."],
      "disadvantages": ["More implementation and validation work."]
    },
    {
      "option_id": "borrow_pretrained",
      "summary": "Use an existing pretrained tokenizer and vocabulary.",
      "advantages": ["Lower initial implementation cost."],
      "disadvantages": ["The vocabulary imports an opaque acquisition history.", "It weakens the glass-box learning objective."]
    }
  ],
  "recommendation": "Build a byte-level BPE tokenizer and retain byte-only encoding as the transparent baseline.",
  "evidence_refs": ["plan/docs/18_GLASSBOX_ENGINEERING_AND_TOKENIZER.md#references"],
  "project_measurement_refs": ["reports/tokenizer/fixture-bakeoff.json"],
  "scientific_variables_affected": ["token_sequence", "sequence_length", "embedding_parameter_count"],
  "pedagogical_value": "Exposes the mapping from UTF-8 bytes to learned lexical units and its model-cost consequences.",
  "risks": ["A tokenizer trained on too little pilot text may learn brittle merges."],
  "failure_tests": ["Round-trip every byte string exactly.", "Require agreement with an independently structured encoder."],
  "owner_decision": "Build the tokenizer in-project; keep the development tokenizer provisional until the pilot bakeoff.",
  "decision_at": "2026-08-11T08:19:00Z",
  "implementation_task_ids": ["t-021", "t-022", "t-023"],
  "artifact_hashes": ["sha256:5454545454545454545454545454545454545454545454545454545454545454"],
  "supersedes_decision_ids": [],
  "superseded_by_decision_id": null,
  "content_hash": "sha256:5353535353535353535353535353535353535353535353535353535353535353"
}
